root@lamp-ubuntu-s-1vcpu-1gb-tor1-01:/usr# tcpdump -i eth0

22:36:16.623720 IP lamp-ubuntu-s-1vcpu-1gb-tor1-01.ssh > 162.243.188.66.38240: Flags [P.], seq 731425:731665, ack 0, win 501, options [nop,nop,TS val 4244246847 ecr 1947772734], length 240
22:36:16.623827 IP lamp-ubuntu-s-1vcpu-1gb-tor1-01.ssh > 162.243.188.66.38240: Flags [P.], seq 731665:731905, ack 0, win 501, options [nop,nop,TS val 4244246848 ecr 1947772734], length 240
22:36:16.623915 IP lamp-ubuntu-s-1vcpu-1gb-tor1-01.ssh > 162.243.188.66.38240: Flags [P.], seq 731905:732145, ack 0, win 501, options [nop,nop,TS val 4244246848 ecr 1947772734], length 240
22:36:16.623982 IP 162.243.188.66.38240 > lamp-ubuntu-s-1vcpu-1gb-tor1-01.ssh: Flags [.], ack 700177, win 501, options [nop,nop,TS val 1947772735 ecr 4244246834], length 0
22:36:16.624058 IP lamp-ubuntu-s-1vcpu-1gb-tor1-01.ssh > 162.243.188.66.38240: Flags [P.], seq 732145:732561, ack 0, win 501, options [nop,nop,TS val 4244246848 ecr 1947772735], length 416
22:36:16.624148 IP lamp-ubuntu-s-1vcpu-1gb-tor1-01.ssh > 162.243.188.66.38240: Flags [P.], seq 732561:732801, ack 0, win 501, options [nop,nop,TS val 4244246848 ecr 1947772735], length 240
22:36:16.624241 IP lamp-ubuntu-s-1vcpu-1gb-tor1-01.ssh > 162.243.188.66.38240: Flags [P.], seq 732801:733041, ack 0, win 501, options [nop,nop,TS val 4244246848 ecr 1947772735], length 240
22:36:16.624328 IP lamp-ubuntu-s-1vcpu-1gb-tor1-01.ssh > 162.243.188.66.38240: Flags [P.], seq 733041:733281, ack 0, win 501, options [nop,nop,TS val 4244246848 ecr 1947772735], length 240
22:36:16.624499 IP lamp-ubuntu-s-1vcpu-1gb-tor1-01.ssh > 162.243.188.66.38240: Flags [P.], seq 733281:733521, ack 0, win 501, options [nop,nop,TS val 4244246848 ecr 1947772735], length 240
22:36:16.624529 IP 162.243.188.66.38240 > lamp-ubuntu-s-1vcpu-1gb-tor1-01.ssh: Flags [.], ack 701793, win 501, options [nop,nop,TS val 1947772735 ecr 4244246835], length 0
22:36:16.624631 IP lamp-ubuntu-s-1vcpu-1gb-tor1-01.ssh > 162.243.188.66.38240: Flags [P.], seq 733521:733937, ack 0, win 501, options [nop,nop,TS val 4244246848 ecr 1947772735], length 416
22:36:16.625000 IP lamp-ubuntu-s-1vcpu-1gb-tor1-01.ssh > 162.243.188.66.38240: Flags [P.], seq 733937:734177, ack 0, win 501, options [nop,nop,TS val 4244246849 ecr 1947772735], length 240
22:36:16.625088 IP 162.243.188.66.38240 > lamp-ubuntu-s-1vcpu-1gb-tor1-01.ssh: Flags [.], ack 703409, win 501, options [nop,nop,TS val 1947772736 ecr 4244246836], length 0
22:36:16.625189 IP lamp-ubuntu-s-1vcpu-1gb-tor1-01.ssh > 162.243.188.66.38240: Flags [P.], seq 734177:734593, ack 0, win 501, options [nop,nop,TS val 4244246849 ecr 1947772736], length 416
22:36:16.625293 IP lamp-ubuntu-s-1vcpu-1gb-tor1-01.ssh > 162.243.188.66.38240: Flags [P.], seq 734593:734833, ack 0, win 501, options [nop,nop,TS val 4244246849 ecr 1947772736], length 240
22:36:16.625388 IP lamp-ubuntu-s-1vcpu-1gb-tor1-01.ssh > 162.243.188.66.38240: Flags [P.], seq 734833:735073, ack 0, win 501, options [nop,nop,TS val 4244246849 ecr 1947772736], length 240
22:36:16.625476 IP lamp-ubuntu-s-1vcpu-1gb-tor1-01.ssh > 162.243.188.66.38240: Flags [P.], seq 735073:735313, ack 0, win 501, options [nop,nop,TS val 4244246849 ecr 1947772736], length 240
22:36:16.625566 IP lamp-ubuntu-s-1vcpu-1gb-tor1-01.ssh > 162.243.188.66.38240: Flags [P.], seq 735313:735553, ack 0, win 501, options [nop,nop,TS val 4244246849 ecr 1947772736], length 240
22:36:16.625656 IP lamp-ubuntu-s-1vcpu-1gb-tor1-01.ssh > 162.243.188.66.38240: Flags [P.], seq 735553:735793, ack 0, win 501, options [nop,nop,TS val 4244246849 ecr 1947772736], length 240
22:36:16.625751 IP lamp-ubuntu-s-1vcpu-1gb-tor1-01.ssh > 162.243.188.66.38240: Flags [P.], seq 735793:736033, ack 0, win 501, options [nop,nop,TS val 4244246850 ecr 1947772736], length 240
22:36:16.625838 IP 162.243.188.66.38240 > lamp-ubuntu-s-1vcpu-1gb-tor1-01.ssh: Flags [.], ack 705025, win 501, options [nop,nop,TS val 1947772736 ecr 4244246836], length 0
22:36:16.625938 IP lamp-ubuntu-s-1vcpu-1gb-tor1-01.ssh > 162.243.188.66.38240: Flags [P.], seq 736033:736273, ack 0, win 501, options [nop,nop,TS val 4244246850 ecr 1947772736], length 240
22:36:16.626027 IP lamp-ubuntu-s-1vcpu-1gb-tor1-01.ssh > 162.243.188.66.38240: Flags [P.], seq 736273:736497, ack 0, win 501, options [nop,nop,TS val 4244246850 ecr 1947772736], length 224
22:36:16.626112 IP lamp-ubuntu-s-1vcpu-1gb-tor1-01.ssh > 162.243.188.66.38240: Flags [P.], seq 736497:736737, ack 0, win 501, options [nop,nop,TS val 4244246850 ecr 1947772736], length 240
22:36:16.626185 IP lamp-ubuntu-s-1vcpu-1gb-tor1-01.ssh > 162.243.188.66.38240: Flags [P.], seq 736737:736977, ack 0, win 501, options [nop,nop,TS val 4244246850 ecr 1947772736], length 240
22:36:16.626294 IP lamp-ubuntu-s-1vcpu-1gb-tor1-01.ssh > 162.243.188.66.38240: Flags [P.], seq 736977:737409, ack 0, win 501, options [nop,nop,TS val 4244246850 ecr 1947772736], length 432
22:36:16.626389 IP lamp-ubuntu-s-1vcpu-1gb-tor1-01.ssh > 162.243.188.66.38240: Flags [P.], seq 737409:737649, ack 0, win 501, options [nop,nop,TS val 4244246850 ecr 1947772736], length 240
22:36:16.626454 IP 162.243.188.66.38240 > lamp-ubuntu-s-1vcpu-1gb-tor1-01.ssh: Flags [.], ack 706881, win 501, options [nop,nop,TS val 1947772737 ecr 4244246837], length 0
22:36:16.626538 IP lamp-ubuntu-s-1vcpu-1gb-tor1-01.ssh > 162.243.188.66.38240: Flags [P.], seq 737649:738065, ack 0, win 501, options [nop,nop,TS val 4244246850 ecr 1947772737], length 416
22:36:16.626634 IP lamp-ubuntu-s-1vcpu-1gb-tor1-01.ssh > 162.243.188.66.38240: Flags [P.], seq 738065:738305, ack 0, win 501, options [nop,nop,TS val 4244246850 ecr 1947772737], length 240
22:36:16.626722 IP lamp-ubuntu-s-1vcpu-1gb-tor1-01.ssh > 162.243.188.66.38240: Flags [P.], seq 738305:738545, ack 0, win 501, options [nop,nop,TS val 4244246850 ecr 1947772737], length 240
22:36:16.626816 IP lamp-ubuntu-s-1vcpu-1gb-tor1-01.ssh > 162.243.188.66.38240: Flags [P.], seq 738545:738785, ack 0, win 501, options [nop,nop,TS val 4244246851 ecr 1947772737], length 240
22:36:16.626906 IP lamp-ubuntu-s-1vcpu-1gb-tor1-01.ssh > 162.243.188.66.38240: Flags [P.], seq 738785:739025, ack 0, win 501, options [nop,nop,TS val 4244246851 ecr 1947772737], length 240
22:36:16.626993 IP lamp-ubuntu-s-1vcpu-1gb-tor1-01.ssh > 162.243.188.66.38240: Flags [P.], seq 739025:739265, ack 0, win 501, options [nop,nop,TS val 4244246851 ecr 1947772737], length 240
22:36:16.627079 IP lamp-ubuntu-s-1vcpu-1gb-tor1-01.ssh > 162.243.188.66.38240: Flags [P.], seq 739265:739505, ack 0, win 501, options [nop,nop,TS val 4244246851 ecr 1947772737], length 240
22:36:16.627179 IP 162.243.188.66.38240 > lamp-ubuntu-s-1vcpu-1gb-tor1-01.ssh: Flags [.], ack 708561, win 501, options [nop,nop,TS val 1947772738 ecr 4244246838], length 0
22:36:16.627193 IP lamp-ubuntu-s-1vcpu-1gb-tor1-01.ssh > 162.243.188.66.38240: Flags [P.], seq 739505:739745, ack 0, win 501, options [nop,nop,TS val 4244246851 ecr 1947772737], length 240
22:36:16.627307 IP lamp-ubuntu-s-1vcpu-1gb-tor1-01.ssh > 162.243.188.66.38240: Flags [P.], seq 739745:740161, ack 0, win 501, options [nop,nop,TS val 4244246851 ecr 1947772738], length 416
22:36:16.627402 IP lamp-ubuntu-s-1vcpu-1gb-tor1-01.ssh > 162.243.188.66.38240: Flags [P.], seq 740161:740401, ack 0, win 501, options [nop,nop,TS val 4244246851 ecr 1947772738], length 240
22:36:16.627490 IP lamp-ubuntu-s-1vcpu-1gb-tor1-01.ssh > 162.243.188.66.38240: Flags [P.], seq 740401:740641, ack 0, win 501, options [nop,nop,TS val 4244246851 ecr 1947772738], length 240
22:36:16.627583 IP lamp-ubuntu-s-1vcpu-1gb-tor1-01.ssh > 162.243.188.66.38240: Flags [P.], seq 740641:740881, ack 0, win 501, options [nop,nop,TS val 4244246851 ecr 1947772738], length 240
22:36:16.627669 IP lamp-ubuntu-s-1vcpu-1gb-tor1-01.ssh > 162.243.188.66.38240: Flags [P.], seq 740881:741121, ack 0, win 501, options [nop,nop,TS val 4244246851 ecr 1947772738], length 240
22:36:16.627757 IP lamp-ubuntu-s-1vcpu-1gb-tor1-01.ssh > 162.243.188.66.38240: Flags [P.], seq 741121:741361, ack 0, win 501, options [nop,nop,TS val 4244246852 ecr 1947772738], length 240
22:36:16.627807 IP 162.243.188.66.38240 > lamp-ubuntu-s-1vcpu-1gb-tor1-01.ssh: Flags [.], ack 710113, win 501, options [nop,nop,TS val 1947772738 ecr 4244246838], length 0
22:36:16.627897 IP lamp-ubuntu-s-1vcpu-1gb-tor1-01.ssh > 162.243.188.66.38240: Flags [P.], seq 741361:741777, ack 0, win 501, options [nop,nop,TS val 4244246852 ecr 1947772738], length 416
22:36:16.628081 IP lamp-ubuntu-s-1vcpu-1gb-tor1-01.ssh > 162.243.188.66.38240: Flags [P.], seq 741777:742017, ack 0, win 501, options [nop,nop,TS val 4244246852 ecr 1947772738], length 240
22:36:16.628183 IP lamp-ubuntu-s-1vcpu-1gb-tor1-01.ssh > 162.243.188.66.38240: Flags [P.], seq 742017:742257, ack 0, win 501, options [nop,nop,TS val 4244246852 ecr 1947772738], length 240
22:36:16.628278 IP lamp-ubuntu-s-1vcpu-1gb-tor1-01.ssh > 162.243.188.66.38240: Flags [P.], seq 742257:742497, ack 0, win 501, options [nop,nop,TS val 4244246852 ecr 1947772738], length 240
22:36:16.628368 IP lamp-ubuntu-s-1vcpu-1gb-tor1-01.ssh > 162.243.188.66.38240: Flags [P.], seq 742497:742737, ack 0, win 501, options [nop,nop,TS val 4244246852 ecr 1947772738], length 240
22:36:16.628464 IP lamp-ubuntu-s-1vcpu-1gb-tor1-01.ssh > 162.243.188.66.38240: Flags [P.], seq 742737:742977, ack 0, win 501, options [nop,nop,TS val 4244246852 ecr 1947772738], length 240
22:36:16.628557 IP lamp-ubuntu-s-1vcpu-1gb-tor1-01.ssh > 162.243.188.66.38240: Flags [P.], seq 742977:743217, ack 0, win 501, options [nop,nop,TS val 4244246852 ecr 1947772738], length 240
22:36:16.628648 IP 162.243.188.66.38240 > lamp-ubuntu-s-1vcpu-1gb-tor1-01.ssh: Flags [.], ack 711729, win 501, options [nop,nop,TS val 1947772739 ecr 4244246839], length 0
22:36:16.628712 IP lamp-ubuntu-s-1vcpu-1gb-tor1-01.ssh > 162.243.188.66.38240: Flags [P.], seq 743217:743457, ack 0, win 501, options [nop,nop,TS val 4244246852 ecr 1947772739], length 240
22:36:16.628841 IP lamp-ubuntu-s-1vcpu-1gb-tor1-01.ssh > 162.243.188.66.38240: Flags [P.], seq 743457:743921, ack 0, win 501, options [nop,nop,TS val 4244246853 ecr 1947772739], length 464
22:36:16.629003 IP lamp-ubuntu-s-1vcpu-1gb-tor1-01.ssh > 162.243.188.66.38240: Flags [P.], seq 743921:744161, ack 0, win 501, options [nop,nop,TS val 4244246853 ecr 1947772739], length 240
22:36:16.629099 IP 162.243.188.66.38240 > lamp-ubuntu-s-1vcpu-1gb-tor1-01.ssh: Flags [.], ack 713345, win 501, options [nop,nop,TS val 1947772740 ecr 4244246840], length 0
22:36:16.629175 IP lamp-ubuntu-s-1vcpu-1gb-tor1-01.ssh > 162.243.188.66.38240: Flags [P.], seq 744161:744401, ack 0, win 501, options [nop,nop,TS val 4244246853 ecr 1947772740], length 240
22:36:16.629264 IP lamp-ubuntu-s-1vcpu-1gb-tor1-01.ssh > 162.243.188.66.38240: Flags [P.], seq 744401:744865, ack 0, win 501, options [nop,nop,TS val 4244246853 ecr 1947772740], length 464
22:36:16.629351 IP lamp-ubuntu-s-1vcpu-1gb-tor1-01.ssh > 162.243.188.66.38240: Flags [P.], seq 744865:745105, ack 0, win 501, options [nop,nop,TS val 4244246853 ecr 1947772740], length 240
22:36:16.629447 IP lamp-ubuntu-s-1vcpu-1gb-tor1-01.ssh > 162.243.188.66.38240: Flags [P.], seq 745105:745345, ack 0, win 501, options [nop,nop,TS val 4244246853 ecr 1947772740], length 240
22:36:16.629540 IP lamp-ubuntu-s-1vcpu-1gb-tor1-01.ssh > 162.243.188.66.38240: Flags [P.], seq 745345:745585, ack 0, win 501, options [nop,nop,TS val 4244246853 ecr 1947772740], length 240
22:36:16.629628 IP lamp-ubuntu-s-1vcpu-1gb-tor1-01.ssh > 162.243.188.66.38240: Flags [P.], seq 745585:745825, ack 0, win 501, options [nop,nop,TS val 4244246853 ecr 1947772740], length 240
22:36:16.629672 IP 162.243.188.66.38240 > lamp-ubuntu-s-1vcpu-1gb-tor1-01.ssh: Flags [.], ack 715201, win 501, options [nop,nop,TS val 1947772740 ecr 4244246840], length 0
22:36:16.629767 IP lamp-ubuntu-s-1vcpu-1gb-tor1-01.ssh > 162.243.188.66.38240: Flags [P.], seq 745825:746241, ack 0, win 501, options [nop,nop,TS val 4244246854 ecr 1947772740], length 416
22:36:16.629865 IP lamp-ubuntu-s-1vcpu-1gb-tor1-01.ssh > 162.243.188.66.38240: Flags [P.], seq 746241:746481, ack 0, win 501, options [nop,nop,TS val 4244246854 ecr 1947772740], length 240
22:36:16.630005 IP lamp-ubuntu-s-1vcpu-1gb-tor1-01.ssh > 162.243.188.66.38240: Flags [P.], seq 746481:746721, ack 0, win 501, options [nop,nop,TS val 4244246854 ecr 1947772740], length 240
22:36:16.630100 IP lamp-ubuntu-s-1vcpu-1gb-tor1-01.ssh > 162.243.188.66.38240: Flags [P.], seq 746721:746961, ack 0, win 501, options [nop,nop,TS val 4244246854 ecr 1947772740], length 240
22:36:16.630196 IP lamp-ubuntu-s-1vcpu-1gb-tor1-01.ssh > 162.243.188.66.38240: Flags [P.], seq 746961:747201, ack 0, win 501, options [nop,nop,TS val 4244246854 ecr 1947772740], length 240
22:36:16.630288 IP lamp-ubuntu-s-1vcpu-1gb-tor1-01.ssh > 162.243.188.66.38240: Flags [P.], seq 747201:747441, ack 0, win 501, options [nop,nop,TS val 4244246854 ecr 1947772740], length 240
22:36:16.630381 IP lamp-ubuntu-s-1vcpu-1gb-tor1-01.ssh > 162.243.188.66.38240: Flags [P.], seq 747441:747681, ack 0, win 501, options [nop,nop,TS val 4244246854 ecr 1947772740], length 240
22:36:16.630473 IP lamp-ubuntu-s-1vcpu-1gb-tor1-01.ssh > 162.243.188.66.38240: Flags [P.], seq 747681:747921, ack 0, win 501, options [nop,nop,TS val 4244246854 ecr 1947772740], length 240
22:36:16.630572 IP lamp-ubuntu-s-1vcpu-1gb-tor1-01.ssh > 162.243.188.66.38240: Flags [P.], seq 747921:748161, ack 0, win 501, options [nop,nop,TS val 4244246854 ecr 1947772740], length 240
22:36:16.630596 IP 162.243.188.66.38240 > lamp-ubuntu-s-1vcpu-1gb-tor1-01.ssh: Flags [.], ack 716881, win 501, options [nop,nop,TS val 1947772741 ecr 4244246841], length 0
22:36:16.630707 IP lamp-ubuntu-s-1vcpu-1gb-tor1-01.ssh > 162.243.188.66.38240: Flags [P.], seq 748161:748577, ack 0, win 501, options [nop,nop,TS val 4244246854 ecr 1947772741], length 416
22:36:16.630803 IP lamp-ubuntu-s-1vcpu-1gb-tor1-01.ssh > 162.243.188.66.38240: Flags [P.], seq 748577:748817, ack 0, win 501, options [nop,nop,TS val 4244246855 ecr 1947772741], length 240
22:36:16.631007 IP lamp-ubuntu-s-1vcpu-1gb-tor1-01.ssh > 162.243.188.66.38240: Flags [P.], seq 748817:749057, ack 0, win 501, options [nop,nop,TS val 4244246855 ecr 1947772741], length 240
22:36:16.631063 IP 162.243.188.66.38240 > lamp-ubuntu-s-1vcpu-1gb-tor1-01.ssh: Flags [.], ack 718497, win 501, options [nop,nop,TS val 1947772742 ecr 4244246841], length 0
22:36:16.631155 IP lamp-ubuntu-s-1vcpu-1gb-tor1-01.ssh > 162.243.188.66.38240: Flags [P.], seq 749057:749473, ack 0, win 501, options [nop,nop,TS val 4244246855 ecr 1947772742], length 416
22:36:16.631255 IP lamp-ubuntu-s-1vcpu-1gb-tor1-01.ssh > 162.243.188.66.38240: Flags [P.], seq 749473:749713, ack 0, win 501, options [nop,nop,TS val 4244246855 ecr 1947772742], length 240
22:36:16.631343 IP lamp-ubuntu-s-1vcpu-1gb-tor1-01.ssh > 162.243.188.66.38240: Flags [P.], seq 749713:749953, ack 0, win 501, options [nop,nop,TS val 4244246855 ecr 1947772742], length 240
22:36:16.631437 IP lamp-ubuntu-s-1vcpu-1gb-tor1-01.ssh > 162.243.188.66.38240: Flags [P.], seq 749953:750193, ack 0, win 501, options [nop,nop,TS val 4244246855 ecr 1947772742], length 240
22:36:16.631526 IP lamp-ubuntu-s-1vcpu-1gb-tor1-01.ssh > 162.243.188.66.38240: Flags [P.], seq 750193:750433, ack 0, win 501, options [nop,nop,TS val 4244246855 ecr 1947772742], length 240
22:36:16.631614 IP lamp-ubuntu-s-1vcpu-1gb-tor1-01.ssh > 162.243.188.66.38240: Flags [P.], seq 750433:750673, ack 0, win 501, options [nop,nop,TS val 4244246855 ecr 1947772742], length 240
22:36:16.631708 IP lamp-ubuntu-s-1vcpu-1gb-tor1-01.ssh > 162.243.188.66.38240: Flags [P.], seq 750673:750913, ack 0, win 501, options [nop,nop,TS val 4244246855 ecr 1947772742], length 240
22:36:16.631805 IP lamp-ubuntu-s-1vcpu-1gb-tor1-01.ssh > 162.243.188.66.38240: Flags [P.], seq 750913:751153, ack 0, win 501, options [nop,nop,TS val 4244246856 ecr 1947772742], length 240
22:36:16.631900 IP lamp-ubuntu-s-1vcpu-1gb-tor1-01.ssh > 162.243.188.66.38240: Flags [P.], seq 751153:751393, ack 0, win 501, options [nop,nop,TS val 4244246856 ecr 1947772742], length 240
22:36:16.631987 IP lamp-ubuntu-s-1vcpu-1gb-tor1-01.ssh > 162.243.188.66.38240: Flags [P.], seq 751393:751633, ack 0, win 501, options [nop,nop,TS val 4244246856 ecr 1947772742], length 240
22:36:16.632007 IP 162.243.188.66.38240 > lamp-ubuntu-s-1vcpu-1gb-tor1-01.ssh: Flags [.], ack 720113, win 501, options [nop,nop,TS val 1947772743 ecr 4244246842], length 0
22:36:16.632128 IP lamp-ubuntu-s-1vcpu-1gb-tor1-01.ssh > 162.243.188.66.38240: Flags [P.], seq 751633:752049, ack 0, win 501, options [nop,nop,TS val 4244246856 ecr 1947772743], length 416
22:36:16.632233 IP lamp-ubuntu-s-1vcpu-1gb-tor1-01.ssh > 162.243.188.66.38240: Flags [P.], seq 752049:752289, ack 0, win 501, options [nop,nop,TS val 4244246856 ecr 1947772743], length 240
22:36:16.632429 IP lamp-ubuntu-s-1vcpu-1gb-tor1-01.ssh > 162.243.188.66.38240: Flags [P.], seq 752289:752529, ack 0, win 501, options [nop,nop,TS val 4244246856 ecr 1947772743], length 240
22:36:16.632530 IP lamp-ubuntu-s-1vcpu-1gb-tor1-01.ssh > 162.243.188.66.38240: Flags [P.], seq 752529:752769, ack 0, win 501, options [nop,nop,TS val 4244246856 ecr 1947772743], length 240
22:36:16.632622 IP lamp-ubuntu-s-1vcpu-1gb-tor1-01.ssh > 162.243.188.66.38240: Flags [P.], seq 752769:753009, ack 0, win 501, options [nop,nop,TS val 4244246856 ecr 1947772743], length 240
22:36:16.632648 IP 162.243.188.66.38240 > lamp-ubuntu-s-1vcpu-1gb-tor1-01.ssh: Flags [.], ack 721969, win 501, options [nop,nop,TS val 1947772743 ecr 4244246843], length 0
22:36:16.632781 IP lamp-ubuntu-s-1vcpu-1gb-tor1-01.ssh > 162.243.188.66.38240: Flags [P.], seq 753009:753425, ack 0, win 501, options [nop,nop,TS val 4244246857 ecr 1947772743], length 416
22:36:16.632877 IP lamp-ubuntu-s-1vcpu-1gb-tor1-01.ssh > 162.243.188.66.38240: Flags [P.], seq 753425:753665, ack 0, win 501, options [nop,nop,TS val 4244246857 ecr 1947772743], length 240
22:36:16.632976 IP lamp-ubuntu-s-1vcpu-1gb-tor1-01.ssh > 162.243.188.66.38240: Flags [P.], seq 753665:753905, ack 0, win 501, options [nop,nop,TS val 4244246857 ecr 1947772743], length 240
22:36:16.633078 IP lamp-ubuntu-s-1vcpu-1gb-tor1-01.ssh > 162.243.188.66.38240: Flags [P.], seq 753905:754145, ack 0, win 501, options [nop,nop,TS val 4244246857 ecr 1947772743], length 240
22:36:16.633169 IP lamp-ubuntu-s-1vcpu-1gb-tor1-01.ssh > 162.243.188.66.38240: Flags [P.], seq 754145:754385, ack 0, win 501, options [nop,nop,TS val 4244246857 ecr 1947772743], length 240
22:36:16.633258 IP lamp-ubuntu-s-1vcpu-1gb-tor1-01.ssh > 162.243.188.66.38240: Flags [P.], seq 754385:754625, ack 0, win 501, options [nop,nop,TS val 4244246857 ecr 1947772743], length 240
22:36:16.633332 IP 162.243.188.66.38240 > lamp-ubuntu-s-1vcpu-1gb-tor1-01.ssh: Flags [.], ack 723585, win 501, options [nop,nop,TS val 1947772744 ecr 4244246844], length 0
22:36:16.633439 IP lamp-ubuntu-s-1vcpu-1gb-tor1-01.ssh > 162.243.188.66.38240: Flags [P.], seq 754625:755041, ack 0, win 501, options [nop,nop,TS val 4244246857 ecr 1947772744], length 416
22:36:16.633546 IP lamp-ubuntu-s-1vcpu-1gb-tor1-01.ssh > 162.243.188.66.38240: Flags [P.], seq 755041:755281, ack 0, win 501, options [nop,nop,TS val 4244246857 ecr 1947772744], length 240
22:36:16.633645 IP lamp-ubuntu-s-1vcpu-1gb-tor1-01.ssh > 162.243.188.66.38240: Flags [P.], seq 755281:755521, ack 0, win 501, options [nop,nop,TS val 4244246857 ecr 1947772744], length 240
22:36:16.633741 IP lamp-ubuntu-s-1vcpu-1gb-tor1-01.ssh > 162.243.188.66.38240: Flags [P.], seq 755521:755761, ack 0, win 501, options [nop,nop,TS val 4244246857 ecr 1947772744], length 240
22:36:16.633837 IP lamp-ubuntu-s-1vcpu-1gb-tor1-01.ssh > 162.243.188.66.38240: Flags [P.], seq 755761:756001, ack 0, win 501, options [nop,nop,TS val 4244246858 ecr 1947772744], length 240
22:36:16.633963 IP lamp-ubuntu-s-1vcpu-1gb-tor1-01.ssh > 162.243.188.66.38240: Flags [P.], seq 756001:756241, ack 0, win 501, options [nop,nop,TS val 4244246858 ecr 1947772744], length 240
22:36:16.634125 IP 162.243.188.66.38240 > lamp-ubuntu-s-1vcpu-1gb-tor1-01.ssh: Flags [.], ack 725201, win 501, options [nop,nop,TS val 1947772745 ecr 4244246844], length 0
22:36:16.634145 IP lamp-ubuntu-s-1vcpu-1gb-tor1-01.ssh > 162.243.188.66.38240: Flags [P.], seq 756241:756481, ack 0, win 501, options [nop,nop,TS val 4244246858 ecr 1947772745], length 240
22:36:16.634262 IP lamp-ubuntu-s-1vcpu-1gb-tor1-01.ssh > 162.243.188.66.38240: Flags [P.], seq 756481:756897, ack 0, win 501, options [nop,nop,TS val 4244246858 ecr 1947772745], length 416
22:36:16.634358 IP lamp-ubuntu-s-1vcpu-1gb-tor1-01.ssh > 162.243.188.66.38240: Flags [P.], seq 756897:757137, ack 0, win 501, options [nop,nop,TS val 4244246858 ecr 1947772745], length 240
22:36:16.634455 IP 162.243.188.66.38240 > lamp-ubuntu-s-1vcpu-1gb-tor1-01.ssh: Flags [.], ack 726817, win 501, options [nop,nop,TS val 1947772745 ecr 4244246845], length 0
22:36:16.634466 IP lamp-ubuntu-s-1vcpu-1gb-tor1-01.ssh > 162.243.188.66.38240: Flags [P.], seq 757137:757377, ack 0, win 501, options [nop,nop,TS val 4244246858 ecr 1947772745], length 240
22:36:16.634578 IP lamp-ubuntu-s-1vcpu-1gb-tor1-01.ssh > 162.243.188.66.38240: Flags [P.], seq 757377:757793, ack 0, win 501, options [nop,nop,TS val 4244246858 ecr 1947772745], length 416
22:36:16.634677 IP lamp-ubuntu-s-1vcpu-1gb-tor1-01.ssh > 162.243.188.66.38240: Flags [P.], seq 757793:758033, ack 0, win 501, options [nop,nop,TS val 4244246858 ecr 1947772745], length 240
22:36:16.634765 IP lamp-ubuntu-s-1vcpu-1gb-tor1-01.ssh > 162.243.188.66.38240: Flags [P.], seq 758033:758273, ack 0, win 501, options [nop,nop,TS val 4244246859 ecr 1947772745], length 240
22:36:16.634860 IP lamp-ubuntu-s-1vcpu-1gb-tor1-01.ssh > 162.243.188.66.38240: Flags [P.], seq 758273:758513, ack 0, win 501, options [nop,nop,TS val 4244246859 ecr 1947772745], length 240
22:36:16.634967 IP lamp-ubuntu-s-1vcpu-1gb-tor1-01.ssh > 162.243.188.66.38240: Flags [P.], seq 758513:758753, ack 0, win 501, options [nop,nop,TS val 4244246859 ecr 1947772745], length 240
22:36:16.635055 IP 162.243.188.66.38240 > lamp-ubuntu-s-1vcpu-1gb-tor1-01.ssh: Flags [.], ack 728369, win 501, options [nop,nop,TS val 1947772746 ecr 4244246846], length 0
22:36:16.635089 IP lamp-ubuntu-s-1vcpu-1gb-tor1-01.ssh > 162.243.188.66.38240: Flags [P.], seq 758753:758993, ack 0, win 501, options [nop,nop,TS val 4244246859 ecr 1947772746], length 240
22:36:16.635199 IP lamp-ubuntu-s-1vcpu-1gb-tor1-01.ssh > 162.243.188.66.38240: Flags [P.], seq 758993:759409, ack 0, win 501, options [nop,nop,TS val 4244246859 ecr 1947772746], length 416
22:36:16.635291 IP lamp-ubuntu-s-1vcpu-1gb-tor1-01.ssh > 162.243.188.66.38240: Flags [P.], seq 759409:759649, ack 0, win 501, options [nop,nop,TS val 4244246859 ecr 1947772746], length 240
22:36:16.635378 IP lamp-ubuntu-s-1vcpu-1gb-tor1-01.ssh > 162.243.188.66.38240: Flags [P.], seq 759649:759889, ack 0, win 501, options [nop,nop,TS val 4244246859 ecr 1947772746], length 240
22:36:16.635467 IP lamp-ubuntu-s-1vcpu-1gb-tor1-01.ssh > 162.243.188.66.38240: Flags [P.], seq 759889:760129, ack 0, win 501, options [nop,nop,TS val 4244246859 ecr 1947772746], length 240
22:36:16.635554 IP lamp-ubuntu-s-1vcpu-1gb-tor1-01.ssh > 162.243.188.66.38240: Flags [P.], seq 760129:760369, ack 0, win 501, options [nop,nop,TS val 4244246859 ecr 1947772746], length 240
22:36:16.635647 IP lamp-ubuntu-s-1vcpu-1gb-tor1-01.ssh > 162.243.188.66.38240: Flags [P.], seq 760369:760609, ack 0, win 501, options [nop,nop,TS val 4244246859 ecr 1947772746], length 240
22:36:16.635737 IP lamp-ubuntu-s-1vcpu-1gb-tor1-01.ssh > 162.243.188.66.38240: Flags [P.], seq 760609:760849, ack 0, win 501, options [nop,nop,TS val 4244246859 ecr 1947772746], length 240
22:36:16.635825 IP lamp-ubuntu-s-1vcpu-1gb-tor1-01.ssh > 162.243.188.66.38240: Flags [P.], seq 760849:761089, ack 0, win 501, options [nop,nop,TS val 4244246860 ecr 1947772746], length 240
22:36:16.635916 IP lamp-ubuntu-s-1vcpu-1gb-tor1-01.ssh > 162.243.188.66.38240: Flags [P.], seq 761089:761329, ack 0, win 501, options [nop,nop,TS val 4244246860 ecr 1947772746], length 240
22:36:16.636001 IP lamp-ubuntu-s-1vcpu-1gb-tor1-01.ssh > 162.243.188.66.38240: Flags [P.], seq 761329:761569, ack 0, win 501, options [nop,nop,TS val 4244246860 ecr 1947772746], length 240
22:36:16.636085 IP 162.243.188.66.38240 > lamp-ubuntu-s-1vcpu-1gb-tor1-01.ssh: Flags [.], ack 730225, win 501, options [nop,nop,TS val 1947772747 ecr 4244246846], length 0
22:36:16.636161 IP lamp-ubuntu-s-1vcpu-1gb-tor1-01.ssh > 162.243.188.66.38240: Flags [P.], seq 761569:761809, ack 0, win 501, options [nop,nop,TS val 4244246860 ecr 1947772747], length 240
22:36:16.636209 IP lamp-ubuntu-s-1vcpu-1gb-tor1-01.ssh > 162.243.188.66.38240: Flags [P.], seq 761809:762033, ack 0, win 501, options [nop,nop,TS val 4244246860 ecr 1947772747], length 224
22:36:16.636314 IP lamp-ubuntu-s-1vcpu-1gb-tor1-01.ssh > 162.243.188.66.38240: Flags [P.], seq 762033:762465, ack 0, win 501, options [nop,nop,TS val 4244246860 ecr 1947772747], length 432
22:36:16.636406 IP lamp-ubuntu-s-1vcpu-1gb-tor1-01.ssh > 162.243.188.66.38240: Flags [P.], seq 762465:762705, ack 0, win 501, options [nop,nop,TS val 4244246860 ecr 1947772747], length 240
22:36:16.636494 IP lamp-ubuntu-s-1vcpu-1gb-tor1-01.ssh > 162.243.188.66.38240: Flags [P.], seq 762705:762945, ack 0, win 501, options [nop,nop,TS val 4244246860 ecr 1947772747], length 240
22:36:16.636563 IP 162.243.188.66.38240 > lamp-ubuntu-s-1vcpu-1gb-tor1-01.ssh: Flags [.], ack 731905, win 501, options [nop,nop,TS val 1947772747 ecr 4244246847], length 0
22:36:16.636654 IP lamp-ubuntu-s-1vcpu-1gb-tor1-01.ssh > 162.243.188.66.38240: Flags [P.], seq 762945:763361, ack 0, win 501, options [nop,nop,TS val 4244246860 ecr 1947772747], length 416
22:36:16.636771 IP lamp-ubuntu-s-1vcpu-1gb-tor1-01.ssh > 162.243.188.66.38240: Flags [P.], seq 763361:763601, ack 0, win 501, options [nop,nop,TS val 4244246861 ecr 1947772747], length 240
22:36:16.636870 IP lamp-ubuntu-s-1vcpu-1gb-tor1-01.ssh > 162.243.188.66.38240: Flags [P.], seq 763601:763841, ack 0, win 501, options [nop,nop,TS val 4244246861 ecr 1947772747], length 240
22:36:16.636962 IP lamp-ubuntu-s-1vcpu-1gb-tor1-01.ssh > 162.243.188.66.38240: Flags [P.], seq 763841:764081, ack 0, win 501, options [nop,nop,TS val 4244246861 ecr 1947772747], length 240
22:36:16.637064 IP lamp-ubuntu-s-1vcpu-1gb-tor1-01.ssh > 162.243.188.66.38240: Flags [P.], seq 764081:764321, ack 0, win 501, options [nop,nop,TS val 4244246861 ecr 1947772747], length 240
22:36:16.637166 IP 162.243.188.66.38240 > lamp-ubuntu-s-1vcpu-1gb-tor1-01.ssh: Flags [.], ack 733521, win 501, options [nop,nop,TS val 1947772748 ecr 4244246848], length 0
22:36:16.637368 IP lamp-ubuntu-s-1vcpu-1gb-tor1-01.ssh > 162.243.188.66.38240: Flags [P.], seq 764321:764737, ack 0, win 501, options [nop,nop,TS val 4244246861 ecr 1947772748], length 416
22:36:16.637471 IP lamp-ubuntu-s-1vcpu-1gb-tor1-01.ssh > 162.243.188.66.38240: Flags [P.], seq 764737:764977, ack 0, win 501, options [nop,nop,TS val 4244246861 ecr 1947772748], length 240
22:36:16.637566 IP lamp-ubuntu-s-1vcpu-1gb-tor1-01.ssh > 162.243.188.66.38240: Flags [P.], seq 764977:765217, ack 0, win 501, options [nop,nop,TS val 4244246861 ecr 1947772748], length 240
22:36:16.637656 IP lamp-ubuntu-s-1vcpu-1gb-tor1-01.ssh > 162.243.188.66.38240: Flags [P.], seq 765217:765457, ack 0, win 501, options [nop,nop,TS val 4244246861 ecr 1947772748], length 240
22:36:16.637743 IP lamp-ubuntu-s-1vcpu-1gb-tor1-01.ssh > 162.243.188.66.38240: Flags [P.], seq 765457:765697, ack 0, win 501, options [nop,nop,TS val 4244246861 ecr 1947772748], length 240
22:36:16.637978 IP lamp-ubuntu-s-1vcpu-1gb-tor1-01.ssh > 162.243.188.66.38240: Flags [P.], seq 765697:765937, ack 0, win 501, options [nop,nop,TS val 4244246862 ecr 1947772748], length 240
22:36:16.638088 IP lamp-ubuntu-s-1vcpu-1gb-tor1-01.ssh > 162.243.188.66.38240: Flags [P.], seq 765937:766177, ack 0, win 501, options [nop,nop,TS val 4244246862 ecr 1947772748], length 240
22:36:16.638141 IP 162.243.188.66.38240 > lamp-ubuntu-s-1vcpu-1gb-tor1-01.ssh: Flags [.], ack 735073, win 501, options [nop,nop,TS val 1947772749 ecr 4244246848], length 0
22:36:16.638234 IP lamp-ubuntu-s-1vcpu-1gb-tor1-01.ssh > 162.243.188.66.38240: Flags [P.], seq 766177:766593, ack 0, win 501, options [nop,nop,TS val 4244246862 ecr 1947772749], length 416
22:36:16.638331 IP lamp-ubuntu-s-1vcpu-1gb-tor1-01.ssh > 162.243.188.66.38240: Flags [P.], seq 766593:766833, ack 0, win 501, options [nop,nop,TS val 4244246862 ecr 1947772749], length 240
22:36:16.638431 IP lamp-ubuntu-s-1vcpu-1gb-tor1-01.ssh > 162.243.188.66.38240: Flags [P.], seq 766833:767073, ack 0, win 501, options [nop,nop,TS val 4244246862 ecr 1947772749], length 240
22:36:16.639149 IP 162.243.188.66.38240 > lamp-ubuntu-s-1vcpu-1gb-tor1-01.ssh: Flags [.], ack 736737, win 501, options [nop,nop,TS val 1947772749 ecr 4244246849], length 0
22:36:16.639177 IP lamp-ubuntu-s-1vcpu-1gb-tor1-01.ssh > 162.243.188.66.38240: Flags [P.], seq 767073:767313, ack 0, win 501, options [nop,nop,TS val 4244246863 ecr 1947772749], length 240
22:36:16.639311 IP lamp-ubuntu-s-1vcpu-1gb-tor1-01.ssh > 162.243.188.66.38240: Flags [P.], seq 767313:767729, ack 0, win 501, options [nop,nop,TS val 4244246863 ecr 1947772749], length 416
22:36:16.639403 IP 162.243.188.66.38240 > lamp-ubuntu-s-1vcpu-1gb-tor1-01.ssh: Flags [.], ack 738305, win 501, options [nop,nop,TS val 1947772750 ecr 4244246850], length 0
22:36:16.639453 IP lamp-ubuntu-s-1vcpu-1gb-tor1-01.ssh > 162.243.188.66.38240: Flags [P.], seq 767729:767969, ack 0, win 501, options [nop,nop,TS val 4244246863 ecr 1947772750], length 240
22:36:16.639575 IP lamp-ubuntu-s-1vcpu-1gb-tor1-01.ssh > 162.243.188.66.38240: Flags [P.], seq 767969:768385, ack 0, win 501, options [nop,nop,TS val 4244246863 ecr 1947772750], length 416
22:36:16.639668 IP lamp-ubuntu-s-1vcpu-1gb-tor1-01.ssh > 162.243.188.66.38240: Flags [P.], seq 768385:768625, ack 0, win 501, options [nop,nop,TS val 4244246863 ecr 1947772750], length 240
22:36:16.639762 IP lamp-ubuntu-s-1vcpu-1gb-tor1-01.ssh > 162.243.188.66.38240: Flags [P.], seq 768625:768865, ack 0, win 501, options [nop,nop,TS val 4244246864 ecr 1947772750], length 240
22:36:16.639853 IP lamp-ubuntu-s-1vcpu-1gb-tor1-01.ssh > 162.243.188.66.38240: Flags [P.], seq 768865:769105, ack 0, win 501, options [nop,nop,TS val 4244246864 ecr 1947772750], length 240
22:36:16.639952 IP lamp-ubuntu-s-1vcpu-1gb-tor1-01.ssh > 162.243.188.66.38240: Flags [P.], seq 769105:769345, ack 0, win 501, options [nop,nop,TS val 4244246864 ecr 1947772750], length 240
22:36:16.640011 IP 162.243.188.66.38240 > lamp-ubuntu-s-1vcpu-1gb-tor1-01.ssh: Flags [.], ack 740161, win 501, options [nop,nop,TS val 1947772751 ecr 4244246850], length 0
22:36:16.640092 IP lamp-ubuntu-s-1vcpu-1gb-tor1-01.ssh > 162.243.188.66.38240: Flags [P.], seq 769345:769761, ack 0, win 501, options [nop,nop,TS val 4244246864 ecr 1947772751], length 416
22:36:16.640201 IP lamp-ubuntu-s-1vcpu-1gb-tor1-01.ssh > 162.243.188.66.38240: Flags [P.], seq 769761:770001, ack 0, win 501, options [nop,nop,TS val 4244246864 ecr 1947772751], length 240
22:36:16.640296 IP lamp-ubuntu-s-1vcpu-1gb-tor1-01.ssh > 162.243.188.66.38240: Flags [P.], seq 770001:770241, ack 0, win 501, options [nop,nop,TS val 4244246864 ecr 1947772751], length 240
22:36:16.640387 IP lamp-ubuntu-s-1vcpu-1gb-tor1-01.ssh > 162.243.188.66.38240: Flags [P.], seq 770241:770481, ack 0, win 501, options [nop,nop,TS val 4244246864 ecr 1947772751], length 240
22:36:16.640474 IP lamp-ubuntu-s-1vcpu-1gb-tor1-01.ssh > 162.243.188.66.38240: Flags [P.], seq 770481:770721, ack 0, win 501, options [nop,nop,TS val 4244246864 ecr 1947772751], length 240
22:36:16.640562 IP lamp-ubuntu-s-1vcpu-1gb-tor1-01.ssh > 162.243.188.66.38240: Flags [P.], seq 770721:770961, ack 0, win 501, options [nop,nop,TS val 4244246864 ecr 1947772751], length 240
22:36:16.640667 IP lamp-ubuntu-s-1vcpu-1gb-tor1-01.ssh > 162.243.188.66.38240: Flags [P.], seq 770961:771201, ack 0, win 501, options [nop,nop,TS val 4244246864 ecr 1947772751], length 240
22:36:16.640784 IP lamp-ubuntu-s-1vcpu-1gb-tor1-01.ssh > 162.243.188.66.38240: Flags [P.], seq 771201:771441, ack 0, win 501, options [nop,nop,TS val 4244246865 ecr 1947772751], length 240
22:36:16.640813 IP 162.243.188.66.38240 > lamp-ubuntu-s-1vcpu-1gb-tor1-01.ssh: Flags [.], ack 741777, win 501, options [nop,nop,TS val 1947772751 ecr 4244246851], length 0
22:36:16.640920 IP lamp-ubuntu-s-1vcpu-1gb-tor1-01.ssh > 162.243.188.66.38240: Flags [P.], seq 771441:771857, ack 0, win 501, options [nop,nop,TS val 4244246865 ecr 1947772751], length 416
22:36:16.641015 IP lamp-ubuntu-s-1vcpu-1gb-tor1-01.ssh > 162.243.188.66.38240: Flags [P.], seq 771857:772097, ack 0, win 501, options [nop,nop,TS val 4244246865 ecr 1947772751], length 240
22:36:16.641102 IP lamp-ubuntu-s-1vcpu-1gb-tor1-01.ssh > 162.243.188.66.38240: Flags [P.], seq 772097:772337, ack 0, win 501, options [nop,nop,TS val 4244246865 ecr 1947772751], length 240
22:36:16.641190 IP lamp-ubuntu-s-1vcpu-1gb-tor1-01.ssh > 162.243.188.66.38240: Flags [P.], seq 772337:772577, ack 0, win 501, options [nop,nop,TS val 4244246865 ecr 1947772751], length 240
22:36:16.641282 IP lamp-ubuntu-s-1vcpu-1gb-tor1-01.ssh > 162.243.188.66.38240: Flags [P.], seq 772577:772817, ack 0, win 501, options [nop,nop,TS val 4244246865 ecr 1947772751], length 240
22:36:16.641371 IP lamp-ubuntu-s-1vcpu-1gb-tor1-01.ssh > 162.243.188.66.38240: Flags [P.], seq 772817:773057, ack 0, win 501, options [nop,nop,TS val 4244246865 ecr 1947772751], length 240
22:36:16.641471 IP lamp-ubuntu-s-1vcpu-1gb-tor1-01.ssh > 162.243.188.66.38240: Flags [P.], seq 773057:773297, ack 0, win 501, options [nop,nop,TS val 4244246865 ecr 1947772751], length 240
22:36:16.641566 IP lamp-ubuntu-s-1vcpu-1gb-tor1-01.ssh > 162.243.188.66.38240: Flags [P.], seq 773297:773537, ack 0, win 501, options [nop,nop,TS val 4244246865 ecr 1947772751], length 240
22:36:16.641665 IP 162.243.188.66.38240 > lamp-ubuntu-s-1vcpu-1gb-tor1-01.ssh: Flags [.], ack 743457, win 501, options [nop,nop,TS val 1947772752 ecr 4244246852], length 0
22:36:16.641677 IP lamp-ubuntu-s-1vcpu-1gb-tor1-01.ssh > 162.243.188.66.38240: Flags [P.], seq 773537:773777, ack 0, win 501, options [nop,nop,TS val 4244246865 ecr 1947772751], length 240
22:36:16.641798 IP lamp-ubuntu-s-1vcpu-1gb-tor1-01.ssh > 162.243.188.66.38240: Flags [P.], seq 773777:774193, ack 0, win 501, options [nop,nop,TS val 4244246866 ecr 1947772752], length 416
22:36:16.641891 IP lamp-ubuntu-s-1vcpu-1gb-tor1-01.ssh > 162.243.188.66.38240: Flags [P.], seq 774193:774433, ack 0, win 501, options [nop,nop,TS val 4244246866 ecr 1947772752], length 240
22:36:16.642002 IP lamp-ubuntu-s-1vcpu-1gb-tor1-01.ssh > 162.243.188.66.38240: Flags [P.], seq 774433:774673, ack 0, win 501, options [nop,nop,TS val 4244246866 ecr 1947772752], length 240
22:36:16.642080 IP 162.243.188.66.38240 > lamp-ubuntu-s-1vcpu-1gb-tor1-01.ssh: Flags [.], ack 745105, win 501, options [nop,nop,TS val 1947772753 ecr 4244246853], length 0
22:36:16.642126 IP lamp-ubuntu-s-1vcpu-1gb-tor1-01.ssh > 162.243.188.66.38240: Flags [P.], seq 774673:774913, ack 0, win 501, options [nop,nop,TS val 4244246866 ecr 1947772753], length 240
22:36:16.642259 IP lamp-ubuntu-s-1vcpu-1gb-tor1-01.ssh > 162.243.188.66.38240: Flags [P.], seq 774913:775329, ack 0, win 501, options [nop,nop,TS val 4244246866 ecr 1947772753], length 416
22:36:16.642351 IP lamp-ubuntu-s-1vcpu-1gb-tor1-01.ssh > 162.243.188.66.38240: Flags [P.], seq 775329:775569, ack 0, win 501, options [nop,nop,TS val 4244246866 ecr 1947772753], length 240
22:36:16.642452 IP lamp-ubuntu-s-1vcpu-1gb-tor1-01.ssh > 162.243.188.66.38240: Flags [P.], seq 775569:775809, ack 0, win 501, options [nop,nop,TS val 4244246866 ecr 1947772753], length 240
22:36:16.642544 IP lamp-ubuntu-s-1vcpu-1gb-tor1-01.ssh > 162.243.188.66.38240: Flags [P.], seq 775809:776049, ack 0, win 501, options [nop,nop,TS val 4244246866 ecr 1947772753], length 240
22:36:16.642697 IP 162.243.188.66.38240 > lamp-ubuntu-s-1vcpu-1gb-tor1-01.ssh: Flags [.], ack 746721, win 501, options [nop,nop,TS val 1947772753 ecr 4244246853], length 0
22:36:16.642825 IP lamp-ubuntu-s-1vcpu-1gb-tor1-01.ssh > 162.243.188.66.38240: Flags [P.], seq 776049:776465, ack 0, win 501, options [nop,nop,TS val 4244246867 ecr 1947772753], length 416
22:36:16.642922 IP lamp-ubuntu-s-1vcpu-1gb-tor1-01.ssh > 162.243.188.66.38240: Flags [P.], seq 776465:776705, ack 0, win 501, options [nop,nop,TS val 4244246867 ecr 1947772753], length 240
22:36:16.643013 IP lamp-ubuntu-s-1vcpu-1gb-tor1-01.ssh > 162.243.188.66.38240: Flags [P.], seq 776705:776945, ack 0, win 501, options [nop,nop,TS val 4244246867 ecr 1947772753], length 240
22:36:16.643103 IP lamp-ubuntu-s-1vcpu-1gb-tor1-01.ssh > 162.243.188.66.38240: Flags [P.], seq 776945:777185, ack 0, win 501, options [nop,nop,TS val 4244246867 ecr 1947772753], length 240
22:36:16.643192 IP lamp-ubuntu-s-1vcpu-1gb-tor1-01.ssh > 162.243.188.66.38240: Flags [P.], seq 777185:777425, ack 0, win 501, options [nop,nop,TS val 4244246867 ecr 1947772753], length 240
22:36:16.643280 IP lamp-ubuntu-s-1vcpu-1gb-tor1-01.ssh > 162.243.188.66.38240: Flags [P.], seq 777425:777665, ack 0, win 501, options [nop,nop,TS val 4244246867 ecr 1947772753], length 240
22:36:16.643372 IP lamp-ubuntu-s-1vcpu-1gb-tor1-01.ssh > 162.243.188.66.38240: Flags [P.], seq 777665:777905, ack 0, win 501, options [nop,nop,TS val 4244246867 ecr 1947772753], length 240
22:36:16.643460 IP lamp-ubuntu-s-1vcpu-1gb-tor1-01.ssh > 162.243.188.66.38240: Flags [P.], seq 777905:778145, ack 0, win 501, options [nop,nop,TS val 4244246867 ecr 1947772753], length 240
22:36:16.643553 IP lamp-ubuntu-s-1vcpu-1gb-tor1-01.ssh > 162.243.188.66.38240: Flags [P.], seq 778145:778385, ack 0, win 501, options [nop,nop,TS val 4244246867 ecr 1947772753], length 240
22:36:16.643582 IP 162.243.188.66.38240 > lamp-ubuntu-s-1vcpu-1gb-tor1-01.ssh: Flags [.], ack 748577, win 501, options [nop,nop,TS val 1947772754 ecr 4244246854], length 0
22:36:16.643684 IP lamp-ubuntu-s-1vcpu-1gb-tor1-01.ssh > 162.243.188.66.38240: Flags [P.], seq 778385:778801, ack 0, win 501, options [nop,nop,TS val 4244246867 ecr 1947772754], length 416
22:36:16.643781 IP lamp-ubuntu-s-1vcpu-1gb-tor1-01.ssh > 162.243.188.66.38240: Flags [P.], seq 778801:779041, ack 0, win 501, options [nop,nop,TS val 4244246868 ecr 1947772754], length 240
22:36:16.643876 IP lamp-ubuntu-s-1vcpu-1gb-tor1-01.ssh > 162.243.188.66.38240: Flags [P.], seq 779041:779281, ack 0, win 501, options [nop,nop,TS val 4244246868 ecr 1947772754], length 240
22:36:16.643967 IP lamp-ubuntu-s-1vcpu-1gb-tor1-01.ssh > 162.243.188.66.38240: Flags [P.], seq 779281:779521, ack 0, win 501, options [nop,nop,TS val 4244246868 ecr 1947772754], length 240
22:36:16.644054 IP lamp-ubuntu-s-1vcpu-1gb-tor1-01.ssh > 162.243.188.66.38240: Flags [P.], seq 779521:779761, ack 0, win 501, options [nop,nop,TS val 4244246868 ecr 1947772754], length 240
22:36:16.644147 IP lamp-ubuntu-s-1vcpu-1gb-tor1-01.ssh > 162.243.188.66.38240: Flags [P.], seq 779761:780001, ack 0, win 501, options [nop,nop,TS val 4244246868 ecr 1947772754], length 240
22:36:16.644233 IP lamp-ubuntu-s-1vcpu-1gb-tor1-01.ssh > 162.243.188.66.38240: Flags [P.], seq 780001:780241, ack 0, win 501, options [nop,nop,TS val 4244246868 ecr 1947772754], length 240
22:36:16.644278 IP 162.243.188.66.38240 > lamp-ubuntu-s-1vcpu-1gb-tor1-01.ssh: Flags [.], ack 750193, win 501, options [nop,nop,TS val 1947772755 ecr 4244246855], length 0
22:36:16.644371 IP lamp-ubuntu-s-1vcpu-1gb-tor1-01.ssh > 162.243.188.66.38240: Flags [P.], seq 780241:780657, ack 0, win 501, options [nop,nop,TS val 4244246868 ecr 1947772755], length 416
22:36:16.644489 IP lamp-ubuntu-s-1vcpu-1gb-tor1-01.ssh > 162.243.188.66.38240: Flags [P.], seq 780657:780897, ack 0, win 501, options [nop,nop,TS val 4244246868 ecr 1947772755], length 240
