root@lamp-ubuntu-s-1vcpu-1gb-tor1-01:/usr# tcpdump -i eth0 tcp
22:51:44.507435 IP 143.198.38.161.22 > 162.243.188.66.38240: Flags [P.], seq 2085345:2085569, ack 0, win 501, options [nop,nop,TS val 4245174731 ecr 1948700618], length 224
22:51:44.507682 IP 143.198.38.161.22 > 162.243.188.66.38240: Flags [P.], seq 2085569:2085793, ack 0, win 501, options [nop,nop,TS val 4245174731 ecr 1948700618], length 224
22:51:44.507937 IP 143.198.38.161.22 > 162.243.188.66.38240: Flags [P.], seq 2085793:2086017, ack 0, win 501, options [nop,nop,TS val 4245174732 ecr 1948700618], length 224
22:51:44.508160 IP 143.198.38.161.22 > 162.243.188.66.38240: Flags [P.], seq 2086017:2086241, ack 0, win 501, options [nop,nop,TS val 4245174732 ecr 1948700618], length 224
22:51:44.508467 IP 143.198.38.161.22 > 162.243.188.66.38240: Flags [P.], seq 2086241:2086465, ack 0, win 501, options [nop,nop,TS val 4245174732 ecr 1948700618], length 224
22:51:44.508658 IP 162.243.188.66.38240 > 143.198.38.161.22: Flags [.], ack 2072769, win 501, options [nop,nop,TS val 1948700619 ecr 4245174718], length 0
22:51:44.508688 IP 143.198.38.161.22 > 162.243.188.66.38240: Flags [P.], seq 2086465:2086689, ack 0, win 501, options [nop,nop,TS val 4245174732 ecr 1948700619], length 224
22:51:44.508863 IP 143.198.38.161.22 > 162.243.188.66.38240: Flags [P.], seq 2086689:2087073, ack 0, win 501, options [nop,nop,TS val 4245174733 ecr 1948700619], length 384
22:51:44.509043 IP 143.198.38.161.22 > 162.243.188.66.38240: Flags [P.], seq 2087073:2087297, ack 0, win 501, options [nop,nop,TS val 4245174733 ecr 1948700619], length 224
22:51:44.509742 IP 143.198.38.161.22 > 162.243.188.66.38240: Flags [P.], seq 2087297:2087521, ack 0, win 501, options [nop,nop,TS val 4245174733 ecr 1948700619], length 224
22:51:44.509976 IP 143.198.38.161.22 > 162.243.188.66.38240: Flags [P.], seq 2087521:2087745, ack 0, win 501, options [nop,nop,TS val 4245174734 ecr 1948700619], length 224
22:51:44.510195 IP 143.198.38.161.22 > 162.243.188.66.38240: Flags [P.], seq 2087745:2087969, ack 0, win 501, options [nop,nop,TS val 4245174734 ecr 1948700619], length 224
22:51:44.510377 IP 143.198.38.161.22 > 162.243.188.66.38240: Flags [P.], seq 2087969:2088193, ack 0, win 501, options [nop,nop,TS val 4245174734 ecr 1948700619], length 224
22:51:44.510633 IP 162.243.188.66.38240 > 143.198.38.161.22: Flags [.], ack 2074497, win 501, options [nop,nop,TS val 1948700621 ecr 4245174719], length 0
22:51:44.510702 IP 143.198.38.161.22 > 162.243.188.66.38240: Flags [P.], seq 2088193:2088417, ack 0, win 501, options [nop,nop,TS val 4245174734 ecr 1948700621], length 224
22:51:44.510996 IP 143.198.38.161.22 > 162.243.188.66.38240: Flags [P.], seq 2088417:2088801, ack 0, win 501, options [nop,nop,TS val 4245174735 ecr 1948700621], length 384
22:51:44.511222 IP 143.198.38.161.22 > 162.243.188.66.38240: Flags [P.], seq 2088801:2089025, ack 0, win 501, options [nop,nop,TS val 4245174735 ecr 1948700621], length 224
22:51:44.511420 IP 162.243.188.66.38240 > 143.198.38.161.22: Flags [.], ack 2076001, win 501, options [nop,nop,TS val 1948700622 ecr 4245174721], length 0
22:51:44.511596 IP 143.198.38.161.22 > 162.243.188.66.38240: Flags [P.], seq 2089025:2089249, ack 0, win 501, options [nop,nop,TS val 4245174735 ecr 1948700622], length 224
22:51:44.511744 IP 143.198.38.161.22 > 162.243.188.66.38240: Flags [P.], seq 2089249:2089457, ack 0, win 501, options [nop,nop,TS val 4245174735 ecr 1948700622], length 208
22:51:44.511886 IP 143.198.38.161.22 > 162.243.188.66.38240: Flags [P.], seq 2089457:2089681, ack 0, win 501, options [nop,nop,TS val 4245174736 ecr 1948700622], length 224
22:51:44.512126 IP 143.198.38.161.22 > 162.243.188.66.38240: Flags [P.], seq 2089681:2089905, ack 0, win 501, options [nop,nop,TS val 4245174736 ecr 1948700622], length 224
22:51:44.512224 IP 143.198.38.161.22 > 162.243.188.66.38240: Flags [P.], seq 2089905:2090129, ack 0, win 501, options [nop,nop,TS val 4245174736 ecr 1948700622], length 224
22:51:44.512375 IP 143.198.38.161.22 > 162.243.188.66.38240: Flags [P.], seq 2090129:2090529, ack 0, win 501, options [nop,nop,TS val 4245174736 ecr 1948700622], length 400
22:51:44.512590 IP 143.198.38.161.22 > 162.243.188.66.38240: Flags [P.], seq 2090529:2090753, ack 0, win 501, options [nop,nop,TS val 4245174736 ecr 1948700622], length 224
22:51:44.512764 IP 143.198.38.161.22 > 162.243.188.66.38240: Flags [P.], seq 2090753:2090977, ack 0, win 501, options [nop,nop,TS val 4245174737 ecr 1948700622], length 224
22:51:44.513041 IP 162.243.188.66.38240 > 143.198.38.161.22: Flags [.], ack 2077505, win 501, options [nop,nop,TS val 1948700623 ecr 4245174723], length 0
22:51:44.513206 IP 143.198.38.161.22 > 162.243.188.66.38240: Flags [P.], seq 2090977:2091201, ack 0, win 501, options [nop,nop,TS val 4245174737 ecr 1948700623], length 224
22:51:44.513346 IP 143.198.38.161.22 > 162.243.188.66.38240: Flags [P.], seq 2091201:2091409, ack 0, win 501, options [nop,nop,TS val 4245174737 ecr 1948700623], length 208
22:51:44.513410 IP 143.198.38.161.22 > 162.243.188.66.38240: Flags [P.], seq 2091409:2091633, ack 0, win 501, options [nop,nop,TS val 4245174737 ecr 1948700623], length 224
22:51:44.513615 IP 143.198.38.161.22 > 162.243.188.66.38240: Flags [P.], seq 2091633:2092033, ack 0, win 501, options [nop,nop,TS val 4245174737 ecr 1948700623], length 400
22:51:44.513806 IP 143.198.38.161.22 > 162.243.188.66.38240: Flags [P.], seq 2092033:2092257, ack 0, win 501, options [nop,nop,TS val 4245174738 ecr 1948700623], length 224
22:51:44.514007 IP 143.198.38.161.22 > 162.243.188.66.38240: Flags [P.], seq 2092257:2092481, ack 0, win 501, options [nop,nop,TS val 4245174738 ecr 1948700623], length 224
22:51:44.514187 IP 143.198.38.161.22 > 162.243.188.66.38240: Flags [P.], seq 2092481:2092705, ack 0, win 501, options [nop,nop,TS val 4245174738 ecr 1948700623], length 224
22:51:44.514410 IP 143.198.38.161.22 > 162.243.188.66.38240: Flags [P.], seq 2092705:2092929, ack 0, win 501, options [nop,nop,TS val 4245174738 ecr 1948700623], length 224
22:51:44.514475 IP 162.243.188.66.38240 > 143.198.38.161.22: Flags [.], ack 2079009, win 501, options [nop,nop,TS val 1948700625 ecr 4245174724], length 0
22:51:44.514733 IP 143.198.38.161.22 > 162.243.188.66.38240: Flags [P.], seq 2092929:2093313, ack 0, win 501, options [nop,nop,TS val 4245174738 ecr 1948700625], length 384
22:51:44.514979 IP 143.198.38.161.22 > 162.243.188.66.38240: Flags [P.], seq 2093313:2093537, ack 0, win 501, options [nop,nop,TS val 4245174739 ecr 1948700625], length 224
22:51:44.515212 IP 143.198.38.161.22 > 162.243.188.66.38240: Flags [P.], seq 2093537:2093761, ack 0, win 501, options [nop,nop,TS val 4245174739 ecr 1948700625], length 224
22:51:44.515448 IP 143.198.38.161.22 > 162.243.188.66.38240: Flags [P.], seq 2093761:2093985, ack 0, win 501, options [nop,nop,TS val 4245174739 ecr 1948700625], length 224
22:51:44.515676 IP 162.243.188.66.38240 > 143.198.38.161.22: Flags [.], ack 2080513, win 501, options [nop,nop,TS val 1948700626 ecr 4245174726], length 0
22:51:44.515883 IP 143.198.38.161.22 > 162.243.188.66.38240: Flags [P.], seq 2093985:2094209, ack 0, win 501, options [nop,nop,TS val 4245174740 ecr 1948700626], length 224
22:51:44.516116 IP 143.198.38.161.22 > 162.243.188.66.38240: Flags [P.], seq 2094209:2094417, ack 0, win 501, options [nop,nop,TS val 4245174740 ecr 1948700626], length 208
22:51:44.516237 IP 143.198.38.161.22 > 162.243.188.66.38240: Flags [P.], seq 2094417:2094641, ack 0, win 501, options [nop,nop,TS val 4245174740 ecr 1948700626], length 224
22:51:44.516536 IP 143.198.38.161.22 > 162.243.188.66.38240: Flags [P.], seq 2094641:2095041, ack 0, win 501, options [nop,nop,TS val 4245174740 ecr 1948700626], length 400
22:51:44.516794 IP 143.198.38.161.22 > 162.243.188.66.38240: Flags [P.], seq 2095041:2095265, ack 0, win 501, options [nop,nop,TS val 4245174741 ecr 1948700626], length 224
22:51:44.516984 IP 162.243.188.66.38240 > 143.198.38.161.22: Flags [P.], seq 0:32, ack 2081793, win 501, options [nop,nop,TS val 1948700627 ecr 4245174727], length 32
22:51:44.516985 IP 162.243.188.66.38240 > 143.198.38.161.22: Flags [P.], seq 32:64, ack 2081793, win 501, options [nop,nop,TS val 1948700627 ecr 4245174727], length 32
^C
9835 packets captured
9836 packets received by filter